{
  "$schema": "http://json-schema.org/draft-07/schema#",
  "$id": "https://aumbrye.dev/schemas/quest-definition.v1.json",
  "title": "QuestDefinition",
  "type": "object",
  "additionalProperties": false,
  "required": ["id", "title", "type", "description"],
  "properties": {
    "id": { "type": "string", "minLength": 1 },
    "title": { "type": "string", "minLength": 1 },
    "type": {
      "enum": [
        "kill",
        "fetch",
        "escape",
        "clear_without",
        "reach_depth",
        "discover",
        "escort",
        "defeat_with"
      ]
    },
    "description": { "type": "string", "minLength": 1 },
    "chainId": { "type": "string", "minLength": 1 },
    "prerequisites": {
      "type": "array",
      "items": { "type": "string", "minLength": 1 }
    },
    "availableWhen": { "type": "object" },
    "bounty": { "enum": ["daily", "weekly"] },
    "repeatable": { "type": "boolean" },
    "maxCompletions": { "type": "integer", "minimum": 1 },
    "cooldownRuns": { "type": "integer", "minimum": 1 },
    "allowedModes": {
      "type": "array",
      "minItems": 1,
      "uniqueItems": true,
      "items": { "enum": ["castle", "endless"] }
    },
    "objectiveMode": { "enum": ["possession", "collection", "delivery"] },
    "targetId": { "type": "string", "minLength": 1 },
    "targetItemId": { "type": "string", "minLength": 1 },
    "targetNpcId": { "type": "string", "minLength": 1 },
    "targetDiscoveryId": { "type": "string", "minLength": 1 },
    "weaponItemId": { "type": "string", "minLength": 1 },
    "requiredCount": { "type": "integer", "minimum": 1 },
    "dungeonId": { "type": "string", "minLength": 1 },
    "biomeId": { "type": "string", "minLength": 1 },
    "minDifficultyTier": { "type": "integer", "minimum": 1 },
    "maxSeconds": { "type": "number", "minimum": 1 },
    "maxKills": { "type": "integer", "minimum": 0 },
    "requiresBoss": { "type": "boolean" },
    "rewards": {
      "type": "object",
      "additionalProperties": false,
      "properties": {
        "gold": { "type": "integer", "minimum": 0 },
        "bountyTokens": { "type": "integer", "minimum": 1 },
        "recipeId": { "type": "string", "minLength": 1 },
        "items": {
          "type": "array",
          "items": {
            "type": "object",
            "additionalProperties": false,
            "required": ["itemId", "quantity"],
            "properties": {
              "itemId": { "type": "string", "minLength": 1 },
              "quantity": { "type": "integer", "minimum": 1 }
            }
          }
        },
        "flags": {
          "type": "array",
          "items": {
            "type": "object",
            "additionalProperties": false,
            "required": ["flag"],
            "properties": {
              "flag": { "type": "string", "minLength": 1 },
              "value": {}
            }
          }
        }
      }
    }
  }
}
